{
  "schema": "boe.mtt.q79-hermitian-metric-hodge-compiler.v1",
  "claim_id": "CBF.T52",
  "date": "2026-08-31",
  "status": "EXACT_SUPPLIED_HERMITIAN_METRIC_TO_FULL_HODGE_AND_EIGHT_SHAPE_RESPONSE_COMPILER_PHYSICAL_Q79_METRIC_HYM_AND_BETA_ROOT_OPEN",
  "source_provenance": {
    "source_lock": "q79_hermitian_metric_hodge_compiler_source_lock.json",
    "source_hashes_match": {
      "T51_THEOREM": true,
      "T51_PACKET": true,
      "PROTOSPINOR_HODGE_TABLE": true,
      "Q79_FUYAU_BASE": true,
      "Q79_HODGE_ACTION_AUDIT": true,
      "Q79_AUGMENTED_HILBERT_COMPILER": true,
      "TRANSPORTED_DELIGNE_METRIC_NATURALITY": true
    },
    "all_source_hashes_match": true,
    "model_state_sha256": "5fdba232d862a95c164603f3156f0cfb8f8abed50af0756edc1618457b5d1f45",
    "handoff_id": "fca40699-fbf5-4374-b01a-ebfcf606869d"
  },
  "metric_hodge_definition": {
    "dimension": 6,
    "basis_dimension": 64,
    "basis_order": [
      "1",
      "e1",
      "e2",
      "e3",
      "e4",
      "e5",
      "e6",
      "e12",
      "e13",
      "e14",
      "e15",
      "e16",
      "e23",
      "e24",
      "e25",
      "e26",
      "e34",
      "e35",
      "e36",
      "e45",
      "e46",
      "e56",
      "e123",
      "e124",
      "e125",
      "e126",
      "e134",
      "e135",
      "e136",
      "e145",
      "e146",
      "e156",
      "e234",
      "e235",
      "e236",
      "e245",
      "e246",
      "e256",
      "e345",
      "e346",
      "e356",
      "e456",
      "e1234",
      "e1235",
      "e1236",
      "e1245",
      "e1246",
      "e1256",
      "e1345",
      "e1346",
      "e1356",
      "e1456",
      "e2345",
      "e2346",
      "e2356",
      "e2456",
      "e3456",
      "e12345",
      "e12346",
      "e12356",
      "e12456",
      "e13456",
      "e23456",
      "nu"
    ],
    "input_contract": "G is an oriented positive covariant metric, H=G^-1, and v>0 satisfies v^2=det(G)",
    "coefficient_formula": "coefficient of e_(I^c) in star_G(e_J) is sgn(I,I^c)*v*det(H[I,J])",
    "defining_identity": "e_I wedge star_G(e_J)=det(H[I,J])*v*nu",
    "variation_formula": "delta(star_G)=star_G*(one_half_trace(G^-1 deltaG)*Id-Lambda^k((G^-1 deltaG)^T))",
    "exact_backend": "rational or exact-algebraic inputs with supplied exact volume root; interval inputs use the same finite minor formula",
    "T51_specialization": "G=I and v=1 gives the CBF.T51 signed-permutation table",
    "orientation_is_input_not_selected": true
  },
  "non_diagonal_hermitian_witness": {
    "complex_coframe_real_part": [
      [
        "1",
        "1",
        "0"
      ],
      [
        "0",
        "1",
        "1"
      ],
      [
        "0",
        "0",
        "1"
      ]
    ],
    "complex_coframe_imaginary_part": [
      [
        "0",
        "1",
        "0"
      ],
      [
        "0",
        "0",
        "-1"
      ],
      [
        "0",
        "0",
        "0"
      ]
    ],
    "real_coframe": [
      [
        "1",
        "0",
        "1",
        "-1",
        "0",
        "0"
      ],
      [
        "0",
        "1",
        "1",
        "1",
        "0",
        "0"
      ],
      [
        "0",
        "0",
        "1",
        "0",
        "1",
        "1"
      ],
      [
        "0",
        "0",
        "0",
        "1",
        "-1",
        "1"
      ],
      [
        "0",
        "0",
        "0",
        "0",
        "1",
        "0"
      ],
      [
        "0",
        "0",
        "0",
        "0",
        "0",
        "1"
      ]
    ],
    "standard_complex_structure": [
      [
        "0",
        "-1",
        "0",
        "0",
        "0",
        "0"
      ],
      [
        "1",
        "0",
        "0",
        "0",
        "0",
        "0"
      ],
      [
        "0",
        "0",
        "0",
        "-1",
        "0",
        "0"
      ],
      [
        "0",
        "0",
        "1",
        "0",
        "0",
        "0"
      ],
      [
        "0",
        "0",
        "0",
        "0",
        "0",
        "-1"
      ],
      [
        "0",
        "0",
        "0",
        "0",
        "1",
        "0"
      ]
    ],
    "covariant_metric_G": [
      [
        "1",
        "0",
        "1",
        "-1",
        "0",
        "0"
      ],
      [
        "0",
        "1",
        "1",
        "1",
        "0",
        "0"
      ],
      [
        "1",
        "1",
        "3",
        "0",
        "1",
        "1"
      ],
      [
        "-1",
        "1",
        "0",
        "3",
        "-1",
        "1"
      ],
      [
        "0",
        "0",
        "1",
        "-1",
        "3",
        "0"
      ],
      [
        "0",
        "0",
        "1",
        "1",
        "0",
        "3"
      ]
    ],
    "covector_metric_H": [
      [
        "7",
        "0",
        "-3",
        "3",
        "2",
        "0"
      ],
      [
        "0",
        "7",
        "-3",
        "-3",
        "0",
        "2"
      ],
      [
        "-3",
        "-3",
        "3",
        "0",
        "-1",
        "-1"
      ],
      [
        "3",
        "-3",
        "0",
        "3",
        "1",
        "-1"
      ],
      [
        "2",
        "0",
        "-1",
        "1",
        "1",
        "0"
      ],
      [
        "0",
        "2",
        "-1",
        "-1",
        "0",
        "1"
      ]
    ],
    "determinant_G": "1",
    "volume_factor": "1",
    "leading_principal_minors": [
      "1",
      "1",
      "1",
      "1",
      "1",
      "1"
    ],
    "positive_definite": true,
    "Hermitian": true,
    "inverse_exact": true,
    "full_Hodge_shape": [
      64,
      64
    ],
    "full_Hodge_sparse_entries": [
      {
        "row": 0,
        "column": 63,
        "value": "1"
      },
      {
        "row": 1,
        "column": 59,
        "value": "-1"
      },
      {
        "row": 1,
        "column": 60,
        "value": "-1"
      },
      {
        "row": 1,
        "column": 62,
        "value": "-1"
      },
      {
        "row": 2,
        "column": 59,
        "value": "1"
      },
      {
        "row": 2,
        "column": 60,
        "value": "-1"
      },
      {
        "row": 2,
        "column": 61,
        "value": "1"
      },
      {
        "row": 3,
        "column": 57,
        "value": "1"
      },
      {
        "row": 3,
        "column": 58,
        "value": "-1"
      },
      {
        "row": 3,
        "column": 60,
        "value": "-3"
      },
      {
        "row": 3,
        "column": 61,
        "value": "1"
      },
      {
        "row": 3,
        "column": 62,
        "value": "-1"
      },
      {
        "row": 4,
        "column": 57,
        "value": "1"
      },
      {
        "row": 4,
        "column": 58,
        "value": "1"
      },
      {
        "row": 4,
        "column": 59,
        "value": "3"
      },
      {
        "row": 4,
        "column": 61,
        "value": "1"
      },
      {
        "row": 4,
        "column": 62,
        "value": "1"
      },
      {
        "row": 5,
        "column": 58,
        "value": "-3"
      },
      {
        "row": 5,
        "column": 59,
        "value": "-1"
      },
      {
        "row": 5,
        "column": 60,
        "value": "-1"
      },
      {
        "row": 6,
        "column": 57,
        "value": "3"
      },
      {
        "row": 6,
        "column": 59,
        "value": "1"
      },
      {
        "row": 6,
        "column": 60,
        "value": "-1"
      },
      {
        "row": 7,
        "column": 47,
        "value": "2"
      },
      {
        "row": 7,
        "column": 50,
        "value": "-1"
      },
      {
        "row": 7,
        "column": 51,
        "value": "-1"
      },
      {
        "row": 7,
        "column": 54,
        "value": "1"
      },
      {
        "row": 7,
        "column": 55,
        "value": "-1"
      },
      {
        "row": 7,
        "column": 56,
        "value": "1"
      },
      {
        "row": 8,
        "column": 43,
        "value": "1"
      },
      {
        "row": 8,
        "column": 44,
        "value": "-1"
      },
      {
        "row": 8,
        "column": 45,
        "value": "1"
      },
      {
        "row": 8,
        "column": 46,
        "value": "-1"
      },
      {
        "row": 8,
        "column": 47,
        "value": "3"
      },
      {
        "row": 8,
        "column": 50,
        "value": "-1"
      },
      {
        "row": 8,
        "column": 51,
        "value": "-1"
      },
      {
        "row": 8,
        "column": 52,
        "value": "1"
      },
      {
        "row": 8,
        "column": 53,
        "value": "-1"
      },
      {
        "row": 8,
        "column": 54,
        "value": "1"
      },
      {
        "row": 8,
        "column": 55,
        "value": "-2"
      },
      {
        "row": 8,
        "column": 56,
        "value": "1"
      },
      {
        "row": 9,
        "column": 43,
        "value": "1"
      },
      {
        "row": 9,
        "column": 44,
        "value": "1"
      },
      {
        "row": 9,
        "column": 45,
        "value": "1"
      },
      {
        "row": 9,
        "column": 46,
        "value": "1"
      },
      {
        "row": 9,
        "column": 47,
        "value": "3"
      },
      {
        "row": 9,
        "column": 50,
        "value": "-1"
      },
      {
        "row": 9,
        "column": 51,
        "value": "-1"
      },
      {
        "row": 9,
        "column": 52,
        "value": "1"
      },
      {
        "row": 9,
        "column": 53,
        "value": "1"
      },
      {
        "row": 9,
        "column": 54,
        "value": "2"
      },
      {
        "row": 9,
        "column": 55,
        "value": "-1"
      },
      {
        "row": 9,
        "column": 56,
        "value": "1"
      },
      {
        "row": 10,
        "column": 44,
        "value": "-3"
      },
      {
        "row": 10,
        "column": 46,
        "value": "-3"